{
  "schema_version": "1.0",
  "artifact_type": "territory_profile",
  "territory_id": "rowend-march",
  "name": "로웬드 변경백령의 발트하르트 남작령",
  "seat": {
    "name": "발트 요새",
    "location": "마르덴 강과 옛 제방길을 내려다보는 동쪽 자갈 능선 위",
    "function": "영주의 거처이자 세금 창고, 경보 망루, 나루와 국경길을 감시하는 마지막 피난처"
  },
  "geography": {
    "regional_position": "세 제국의 완충지대 북서쪽 끝, 내륙 교역로가 국경 군수로로 바뀌기 직전의 작은 변경 영지",
    "landforms": [
      "북쪽 침엽수 고지에서 시작해 남서쪽으로 급히 내려오는 마르덴 강",
      "강이 넓게 퍼지는 하얀갈대 분지의 범람원과 얕은 습지",
      "요새와 오래된 제방길만이 물 위로 드러나는 두 줄의 낮은 자갈 능선",
      "그레이포드 나루가 유일하게 마차가 강을 건널 수 있는 좁은 여울"
    ],
    "watershed": "상류의 늦은 눈과 벌목지에서 물이 한꺼번에 내려오고, 분지는 물을 잠시 품지만 망가진 수문과 저수 시설 때문에 농번기에는 물을 붙잡지 못한다.",
    "settlement_pattern": "마을은 물가를 피한 능선 발치와 제방 뒤에 흩어져 있으며, 밭·목초지·갈대밭을 오가려면 모두 같은 진흙길이나 나루를 지나야 한다.",
    "visual_anchors": [
      "흰 갈대 바다 사이로 굽이치는 잿빛 마르덴 강",
      "물때가 남은 낡은 목제 수문과 기울어진 제방 표지석",
      "비가 오면 섬처럼 고립되는 자갈 능선의 발트 요새",
      "안개 너머 그레이포드 나루의 쇠사슬과 평저선",
      "진흙에 반쯤 잠긴 옛 제방길의 수레바퀴 자국"
    ]
  },
  "climate": {
    "classification": "눈이 많은 고지와 짧은 건조기가 공존하는 서늘한 대륙성 변경 기후",
    "annual_cycle": [
      {"season": "해빙기", "conditions": "상류의 늦은 눈이 녹고 숲의 물길이 급해진다.", "territory_effect": "강 수위와 진흙길의 상태가 며칠 사이에 바뀌어 파종·운송·나루 운영의 계획을 흔든다."},
      {"season": "짧은 여름", "conditions": "비는 적고 얕은 토양은 빨리 마른다.", "territory_effect": "해빙기에 흘려보낸 물을 저장하지 못한 밭과 우물이 먼저 버티지 못한다."},
      {"season": "가을 안개", "conditions": "수온이 떨어지고 갈대밭의 물이 고이며 새벽 안개가 오래 남는다.", "territory_effect": "건초 말리기와 곡물 운반이 늦어지고, 가축과 사람의 열병 소문이 쉽게 번진다."},
      {"season": "긴 겨울", "conditions": "능선 밖 길이 얼고 북풍이 강을 따라 분다.", "territory_effect": "마차와 보급대가 줄어들어 가을에 쌓지 못한 부족분이 곧 빚과 이탈로 이어진다."}
    ]
  },
  "resources": [
    {"id": "river-transport", "name": "마르덴 강의 계절 수운", "availability": "수위가 안정된 시기에는 나루와 평저선으로 곡물·목재를 육로보다 많이 옮길 수 있다.", "current_barrier": "나루 통행권이 외지 상인에게 담보로 잡혀 있고, 낡은 수문과 선착장이 작은 물 변화에도 멈춘다.", "potential": "수운·창고·시장 규칙을 함께 고치면 외진 위치를 교역 거점으로 바꿀 수 있다."},
    {"id": "reed-and-fish", "name": "갈대·어류·이탄이 나는 습지", "availability": "갈대밭은 지붕재와 바구니 재료를, 얕은 물은 생선과 이탄을 준다.", "current_barrier": "공동 채취 규칙이 없어 과채취와 방화가 반복되고, 습지를 오직 불모지로 여겨 관리할 사람이 없다.", "potential": "채취권과 건조장을 정비하면 겨울 연료·부업·식량을 동시에 늘릴 수 있다."},
    {"id": "upland-forest-and-gravel", "name": "고지의 침엽수와 자갈 능선", "availability": "상류 숲은 목재를, 능선은 제방과 길을 보수할 자갈을 제공한다.", "current_barrier": "벌목권은 흩어져 있고, 자갈을 나를 길과 징발되지 않은 장정이 모자라 개발비가 수익을 앞선다.", "potential": "벌목·운반·제방 보수를 한 장부로 묶으면 재료 조달과 치수의 순환을 만들 수 있다."}
  ],
  "population": {
    "estimated_total": 480,
    "settlements": [
      {"id": "walt-fort", "name": "발트 요새 마을", "population": 142, "livelihood": "성의 잡역, 소규모 장사, 창고·마구간 노동"},
      {"id": "grayford", "name": "그레이포드 나루", "population": 96, "livelihood": "나루, 평저선, 어업, 여관"},
      {"id": "reedfield", "name": "갈대밭촌", "population": 131, "livelihood": "저지대 농사, 갈대 채취, 가축 방목"},
      {"id": "stonefoot", "name": "돌능선촌", "population": 111, "livelihood": "고지 밭농사, 벌목, 자갈 채취"}
    ],
    "demographic_pressure": "국경 징발과 빚 때문에 일할 청년이 계절마다 빠져나가고, 남은 주민은 아이·노인·과부의 비중이 높다. 따라서 대규모 공사나 장기 동원은 곧 농사와 돌봄의 공백이 된다."
  },
  "infrastructure": [
    {"id": "old-embankment-road", "name": "옛 제방길", "status": "구간마다 낮아지고 돌이 빠진 임시 보수 상태", "function": "요새·갈대밭촌·나루를 잇는 유일한 마차길", "failure_mode": "비와 수위 변화가 겹치면 진흙길이 되어 마차·환자·병참이 모두 늦어진다."},
    {"id": "wooden-sluice", "name": "목제 수문과 배수 도랑", "status": "경첩과 말뚝이 썩어 수위를 세밀하게 조절할 수 없는 상태", "function": "범람원으로 들어온 물을 빼고, 밭과 갈대밭의 물길을 나눈다.", "failure_mode": "닫아야 할 때 새고 열어야 할 때 걸려 물이 너무 많거나 너무 적은 문제가 번갈아 생긴다."},
    {"id": "grayford-ferry", "name": "그레이포드 나루와 평저선", "status": "배는 쓸 수 있으나 계류 쇠사슬과 선착장이 낡았고 통행권은 빚 담보 상태", "function": "사람·말·곡물을 강 건너 시장과 국경길로 넘긴다.", "failure_mode": "수위·담보권자·선주의 판단 가운데 하나만 어긋나도 영지 전체의 현금과 보급이 멈춘다."},
    {"id": "fort-granary", "name": "요새 곡물창", "status": "벽은 튼튼하지만 환기와 장부가 부실한 낡은 저장고", "function": "세곡·비상식량·군수 물자를 보관한다.", "failure_mode": "습기와 분산 장부 때문에 실제 재고보다 많은 식량이 있다고 믿기 쉽다."}
  ],
  "chronic_problems": [
    {"id": "water-without-reserve", "title": "물은 넘치는데 농사철에는 물이 없다", "symptom": "해빙기에는 밭을 밟지 못하고, 짧은 여름에는 밭과 우물이 먼저 마른다.", "root_causes": ["상류의 급한 유입", "무너진 수문과 도랑", "저수·배수·파종을 따로 판단하는 관행"], "downstream_effects": ["낮은 수확", "종자 빚", "해마다 바뀌는 날씨를 저주로 여기는 주민 불신"], "latent_opportunity": "물을 단순히 막는 대신 저장·우회·공동 관리하면 수확량과 습지 부업을 함께 안정시킬 수 있다.", "decision_owners": ["테오의 장부·우선순위 설계", "브람의 세금·권리 조정", "주민의 공동 노동"]},
    {"id": "mud-road-isolation", "title": "길이 아니라 진흙", "symptom": "같은 영지 안에서도 장날, 환자 이송, 군수 마차가 날씨에 따라 끊긴다.", "root_causes": ["범람원 한가운데를 지나는 단일 제방길", "매년 땜질만 하는 보수", "농번기에 공사 인력이 비는 인구 구조"], "downstream_effects": ["시장 가격 왜곡", "나루 의존 심화", "국경 경보와 구조 지연"], "latent_opportunity": "자갈·목재·노역을 한 구간에 집중하면 장사와 병참 모두에 쓰이는 높은 길을 만들 수 있다.", "decision_owners": ["카일의 공사 호위·구조 동선", "테오의 자재·노역 계산", "브람의 우선순위 승인"]},
    {"id": "mortgaged-ferry", "title": "빚으로 묶인 나루", "symptom": "영지에서 난 물자가 나가도 통행료와 선착장 비용이 먼저 외지 상인의 장부로 들어간다.", "root_causes": ["과거 흉년에 맺은 담보 계약", "현금 부족", "나루와 시장을 따로 관리하는 관행"], "downstream_effects": ["세입 누수", "상인의 가격 조작", "위기 때 식량을 되사 와야 하는 역전 현상"], "latent_opportunity": "나루의 가치와 채무 구조를 정확히 드러내면 재협상·공동 시장·수운 확장이라는 선택지가 생긴다.", "decision_owners": ["테오의 채무 장부와 협상", "브람의 영주 권한", "카일의 나루 안전 보장"]},
    {"id": "war-takes-harvest", "title": "전쟁이 수확을 빼앗는다", "symptom": "국경 분쟁 때마다 장정·말·수레가 파종과 수확 시기에 징발된다.", "root_causes": ["완충지대의 전략적 위치", "중앙의 일괄 징발", "영지에 남는 예비 인력과 운송 수단의 부족"], "downstream_effects": ["다음 해 생산 감소", "가문에 대한 원망", "방어와 생계가 서로를 갉아먹는 악순환"], "latent_opportunity": "현장 전력과 병참을 분리해 준비하면 카일의 방어력과 테오의 생산 계획이 서로를 살리는 공동 성과가 된다.", "decision_owners": ["카일의 전력·훈련 판단", "테오의 보급·대체 노동 설계", "브람의 중앙 교섭"]},
    {"id": "fragmented-rights", "title": "땅의 권리가 조각나 있다", "symptom": "한 장의 지도에는 같은 땅처럼 보여도, 밭·목초·갈대·숲의 사용권자가 달라 어떤 수리도 즉시 시작할 수 없다.", "root_causes": ["옛 전쟁 보상과 종교 기부", "부재 지주의 소유권", "관습으로만 이어진 공동 이용권"], "downstream_effects": ["공사 지연", "마을 간 책임 떠넘기기", "외지 세력이 작은 분쟁을 정치적으로 이용"], "latent_opportunity": "권리 지도를 만들고 이익을 나누면 토지 분쟁을 주민 참여와 세입 기반으로 바꿀 수 있다.", "decision_owners": ["테오의 조사·계약 설계", "브람의 중재 권한", "마을 대표의 동의"]}
  ],
  "disaster_exposure": [
    {"id": "rapid-thaw-water-rise", "trigger_conditions": ["상류 늦은 눈의 급격한 해빙", "벌목지의 토사와 강한 비"], "vulnerabilities": ["낡은 수문", "낮은 제방길", "나루와 창고로 집중된 운송"], "possible_consequences": ["통행 단절", "파종 지연", "저지대 재고의 습기 피해"], "scenario_not_scheduled": true},
    {"id": "short-summer-water-shortage", "trigger_conditions": ["해빙기 물을 저장하지 못함", "짧은 여름의 적은 강우와 바람"], "vulnerabilities": ["얕은 토양", "낮은 저수 능력", "종자와 식량의 낮은 여유"], "possible_consequences": ["밭·우물 고갈", "가축 방목지 감소", "종자 빚 증가"], "scenario_not_scheduled": true},
    {"id": "autumn-marsh-sickness", "trigger_conditions": ["가을 안개와 고인 물", "젖은 곡물과 늦은 건초"], "vulnerabilities": ["분산된 마을", "진흙길", "부족한 저장 위생"], "possible_consequences": ["열병 소문", "가축 손실", "수확·운송 인력 이탈"], "scenario_not_scheduled": true},
    {"id": "winter-isolation", "trigger_conditions": ["이른 결빙과 강한 북풍", "가을 보급 실패"], "vulnerabilities": ["나루 의존", "낡은 곡물창", "부족한 현금"], "possible_consequences": ["시장 단절", "식량 가격 급등", "빚과 이주 증가"], "scenario_not_scheduled": true}
  ],
  "development_constraints": [
    "테오는 전생의 행정 실패를 기억할 뿐 미래 지식·만능 기술·마법으로 물리적 한계를 건너뛸 수 없다.",
    "공사는 농번기 노동, 군사 훈련, 가계 돌봄 중 하나 이상을 반드시 희생시키므로 순서와 보상이 핵심 갈등이 된다.",
    "국경의 안전 요구와 외지 상인의 계약은 영주의 결정만으로 무효화되지 않으며, 모든 개선에는 협상과 반발이 따른다.",
    "카일은 현장 지휘와 보호를, 테오는 공급·계약·장기 우선순위를 맡는다. 한쪽이 다른 쪽의 역할을 편의상 대체하지 않는다."
  ],
  "continuity_rules": [
    "마르덴 강·하얀갈대 분지·두 자갈 능선·그레이포드 나루는 이후 지도, 배경 시트, 디렉터 브리프에서 일관된 위치 관계를 유지한다.",
    "재난 노출 목록은 가능성이지 발생 순서가 아니다. 특정 해의 사건은 에피소드 스크립트에서 계절·선행 결정·정치 상황과 함께 선택한다.",
    "수문, 제방길, 나루, 곡물창을 고치면 각각 다른 자원·권리·정치 비용이 생기며, 한 번의 해결로 모든 문제가 사라지지 않는다.",
    "습지는 위험한 배경이면서 갈대·생선·이탄·방어 지형이라는 자산이다. 장면은 고통과 활용 가능성을 함께 보여 준다."
  ]
}
